{
  "schema_version": "1.0.0",
  "metadata": { "last_updated": "2026-05-15T08:55:00Z" },
  "baseline": {
    "model_id": "claude-opus-4-7",
    "first_observed_at": "2026-04-15T00:00:00Z",
    "audit_run_ids": [
      "2026-04-15T00:00:00.000000+00:00",
      "2026-04-20T00:00:00.000000+00:00"
    ]
  },
  "last_seen": {
    "model_id": "claude-opus-4-7",
    "audit_run_id": "2026-04-20T00:00:00.000000+00:00",
    "observed_at": "2026-04-20T00:00:00Z"
  },
  "legacy_migration": {
    "source_changelog_anchor_run_id": "2026-04-15T00:00:00Z"
  }
}
